{
  "outcomeID": "example",
  "status": "SUCCEEDED",
  "recoveryCategory": "NO_ACTION",
  "diagnosticReference": {
    "diagnosticID": "example",
    "chainRootReference": "example",
    "diagnosticKind": "STATE_VALIDITY",
    "ruleReferences": [
      {
        "ruleID": "ASH-STATE-VALIDITY-001",
        "sourceReference": "example",
        "ruleFamily": "example"
      }
    ]
  }
}
